{
  "interface": "knowledge-system-interface/v1",
  "caller": "agentic-os",
  "capability": "agentic-os.social-compose",
  "objective": "Compose public-safe social candidates from current strategy, selected work, recorded stances, and audience continuity.",
  "roles": {
    "required": [
      "social-rules-of-engagement"
    ],
    "optional": [
      "selected-projects",
      "public-safe-claim-source",
      "identity",
      "point-of-view",
      "published-social-context"
    ]
  },
  "intended_use": {
    "mode": "public-draft",
    "purpose": "Prepare an approval-gated social content proposal and approved drafts.",
    "boundary": "Use only claim-level public-facing meaning in copy. Do not publish, expose private guidance, or copy operational source records into Knowledge.",
    "target": "social-draft-queue"
  },
  "requirements": {
    "evidence": "required",
    "claim_provenance": true,
    "freshness": "current for this run"
  },
  "mandate": {
    "purpose": "Read only the social context needed for this run and propose semantic captures for an explicitly stated stance or post-live audience continuity.",
    "read_roles": [
      "social-rules-of-engagement",
      "selected-projects",
      "public-safe-claim-source",
      "identity",
      "point-of-view",
      "published-social-context"
    ],
    "capture_roles": [
      "point-of-view",
      "published-social-context"
    ],
    "public_facing_roles": [
      "selected-projects",
      "public-safe-claim-source",
      "identity",
      "point-of-view",
      "published-social-context"
    ],
    "clarification_on_unresolved": true
  },
  "clarification_allowed": true
}
