{
  "interface": "knowledge-system-interface/v1",
  "caller": "agentic-os",
  "capability": "agentic-os.pursue",
  "objective": "Build current Career profile and throughput inputs for safely planning existing opportunities and reviewing confirmed waits.",
  "roles": {
    "required": [
      "identity",
      "job-search-strategy",
      "personal-constraints",
      "public-safe-claim-source",
      "proof-points"
    ],
    "optional": ["communication-strategy"]
  },
  "intended_use": {
    "mode": "named-sink",
    "purpose": "Reconcile a fresh Career profile, plan safe next work, and review confirmed waits through the Career System gateway.",
    "boundary": "Do not submit applications, send messages, contact people, assert external events, or persist an Agentic OS profile cache.",
    "target": "career-system"
  },
  "requirements": {
    "evidence": "required",
    "claim_provenance": true,
    "freshness": "current for this invocation"
  },
  "mandate": {
    "purpose": "Supply only current profile, throughput, and optional personalization context required by agentic-os.pursue.",
    "read_roles": [
      "identity",
      "job-search-strategy",
      "personal-constraints",
      "public-safe-claim-source",
      "proof-points",
      "communication-strategy"
    ],
    "capture_roles": [],
    "public_facing_roles": [],
    "clarification_on_unresolved": false
  },
  "clarification_allowed": false
}
