{
  "interface": "knowledge-system-interface/v1",
  "caller": "agentic-os",
  "capability": "agentic-os.portfolio-refresh",
  "objective": "Compare current public-safe Knowledge context with the portfolio and propose evidence-backed surface changes.",
  "roles": {
    "required": [
      "portfolio-change-rules"
    ],
    "optional": [
      "public-safe-claim-source",
      "network",
      "selected-projects",
      "identity"
    ]
  },
  "intended_use": {
    "mode": "named-sink",
    "purpose": "Prepare an approval-gated portfolio change proposal and approved branch or draft pull request work.",
    "boundary": "Use only claim-level public-facing meaning in portfolio content. Do not expose private guidance, merge, deploy, publish, or mutate Knowledge.",
    "target": "portfolio"
  },
  "requirements": {
    "evidence": "required",
    "claim_provenance": true,
    "freshness": "current for this run"
  },
  "mandate": {
    "purpose": "Read only the public-surface context and private structural guidance needed to propose portfolio changes.",
    "read_roles": [
      "public-safe-claim-source",
      "network",
      "selected-projects",
      "portfolio-change-rules",
      "identity"
    ],
    "capture_roles": [],
    "public_facing_roles": [
      "public-safe-claim-source",
      "network",
      "selected-projects",
      "identity"
    ],
    "clarification_on_unresolved": true
  },
  "clarification_allowed": true
}
